Sheet: Sheet1
C1: at | D1: co | E1: dr | F1: ei | G1: em | H1: he | I1: in | J1: me | K1: mo | L1: mu | M1: no | N1: sa | O1: sp | P1: ul | R1: avg | S1: std | T1: workers | U1: volunteers | V1: condorcet | W1: proposal
A2: Kim | B2: The Surveilled at Home | C2: 15 | D2: 30 | E2: 40 | F2: 5 | G2: 30 | H2: 26 | I2: 17.3 | J2: 30 | K2: 21 | L2: 20 | M2: 27 | N2: 40 | O2: 30 | P2: 25 | R2: of:=AVERAGE([.C2:.P2]) -> 25.45 | S2: of:=STDEV([.C2:.P2]) -> 9.41543332063823 | T2: of:=AVERAGE([.D2];[.G2];[.H2];[.I2];[.J2];[.N2];[.P2]) -> 28.3285714285714 | U2: of:=AVERAGE([.C2];[.E2];[.F2];[.K2];[.L2];[.M2];[.O2]) -> 22.5714285714286 | V2: 3 | W2: 2
A3: Cris | B3: The Information Gatherer | C3: 30 | D3: 22 | E3: 30 | F3: 35 | G3: 26 | H3: 21 | I3: 34 | J3: 20 | K3: 19 | L3: 25 | M3: 23 | N3: 30 | O3: 15 | P3: 27 | R3: of:=AVERAGE([.C3:.P3]) -> 25.5 | S3: of:=STDEV([.C3:.P3]) -> 5.86711828098573 | T3: of:=AVERAGE([.D3];[.G3];[.H3];[.I3];[.J3];[.N3];[.P3]) -> 25.7142857142857 | U3: of:=AVERAGE([.C3];[.E3];[.F3];[.K3];[.L3];[.M3];3) -> 23.5714285714286 | V3: 1 | W3: 2
A4: Riou | B4: The Censorship Evader | C4: 20 | D4: 28 | E4: 25 | F4: 40 | G4: 20 | H4: 30 | I4: 36 | J4: 40 | K4: 35 | L4: 40 | M4: 32 | N4: 20 | O4: 40 | P4: 28 | R4: of:=AVERAGE([.C4:.P4]) -> 31 | S4: of:=STDEV([.C4:.P4]) -> 7.76580274715321 | T4: of:=AVERAGE([.D4];[.G4];[.H4];[.I4];[.J4];[.N4];[.P4]) -> 28.8571428571429 | U4: of:=AVERAGE([.C4];[.E4];[.F4];[.K4];[.L4];[.M4];4) -> 28 | V4: 2 | W4: 1
A5: Derya | B5: The Privacy Advocate | C5: 35 | D5: 20 | E5: 5 | F5: 20 | G5: 24 | H5: 23 | I5: 12.7 | J5: 10 | K5: 25 | L5: 15 | M5: 18 | N5: 10 | O5: 15 | P5: 20 | R5: of:=AVERAGE([.C5:.P5]) -> 18.05 | S5: of:=STDEV([.C5:.P5]) -> 7.61605086440675 | T5: of:=AVERAGE([.D5];[.G5];[.H5];[.I5];[.J5];[.N5];[.P5]) -> 17.1 | U5: of:=AVERAGE([.C5];[.E5];[.F5];[.K5];[.L5];[.M5];5) -> 17.5714285714286 | V5: 4 | W5: -
A7: Comments
B8: Is worried about Riou being the most tech savvy of the remaining ones
A10: People missing
A11: Things we can integrate or make stronger
B12: Older people challenged with accessibility concerns
B13: Accessibility/handicaped people (should be part of the existing personas)
B14: 40-50 yo
B15: Non-standard female body
B16: Cryptocurrency user
B17: People who don’t want to carry much with them
B18: Non-technical person “uses Tails just because it gives a unique interfaces” uses the PC not a lot
A19: Things that wouldn't make it to the top
B20: People who don’t want to spend money on personal computer
B21: Companies: ensuring data protection, lawyers, doctors, etc.
B22: A list of 9 ideas that I can’t really take all into account (but thanks for all the creativity!)
B23: Dark net customer
B24: Anti-personas: who Tails is not targeted for