Sheet: issues
B1: M?
A2: Participant | C2: P1 | D2: P2 | E2: P3 | F2: P4 | G2: P5 | I2: B | J2: C | K2: B/C | L2: Ticket | M2: Solution
A3: Mission completeness
A4: Mission 1: Add Mumble to Tails | C4: 0 | D4: 1 | E4: 1 | F4: 1 | G4: 1
A5: Time on mission 1 | C5: 120 | D5: 55 | E5: 28 | F5: 20 | G5: 32 | H5: of:=AVERAGE([.D5:.F5]) -> 34.3333333333333
A6: Mission 2: Restart and use Tails | C6: 0 | D6: 1 | E6: 1 | F6: 1 | G6: 1
A7: Mission 3: Check list of AS | C7: 0 | D7: 1 | E7: 1 | F7: 1 | G7: 1
A8: Mission 4: Remove mumble from AS | C8: 1 | D8: 1 | E8: 1 | F8: 1 | G8: 1
A10: Administration password
A11: Looks for Synaptic but can’t find it (without admin password) | B11: M1 | I11: 3 | J11: 1 | K11: of:=6*[.I11]/[.J11] -> 18 | L11: #11013 | M11: Revert #11013
A12: Link to Synaptic is broken without admin password | B12: M1 | I12: '’ | J12: '’ | K12: '’ | L12: '’ | M12: '’
A13: Doesn’t know which admin password to enter when prompted | B13: M1 | I13: 2 | J13: 3 | K13: of:=6*[.I13]/[.J13] -> 4 | L13: #9554 | M13: Explain how to set an administration password instead of asking for one when none is set
A14: Doesn’t find our doc when searching online for “how to be root on tails” | B14: M1 | I14: 2 | J14: 1 | K14: of:=6*[.I14]/[.J14] -> 12 | L14: #15571 | M14: Improve SEO when people search for "root" instead of "administration"
A15: Tries first `su` instead of `sudo` | B15: M1 | I15: 1 | J15: 3 | K15: of:=6*[.I15]/[.J15] -> 2 | L15: #15583 | M15: Replace `su` by a message to use sudo
A16: Doesn’t open the file URL from sudo (without admin password) | B16: M1 | I16: 1 | J16: 1 | K16: of:=6*[.I16]/[.J16] -> 6 | L16: #15582 | M16: Avoid displaying file URLs to users
A18: Missing APT lists
A19: Doesn’t understand why `apt install` fails (without lists) | B19: M1 | I19: 2 | J19: 2 | K19: of:=6*[.I19]/[.J19] -> 6 | L19: #15584 | M19: Wrap apt to download lists if there are none
A20: Goes back to Synaptic after failed `apt install` without APT lists | B20: M1 | I20: '’ | J20: '’ | K20: or | L20: #12238 | M20: Ship full APT lists in the live file system
A21: Looks online for how to get pass having no APT lists | B21: M1 | I21: '’ | J21: '’ | K21: '’ | L21: '’ | M21: '’
A22: Thinks that apt has lists because the output reads “Reading package lists... Done” | B22: M1 | I22: '’ | J22: '’ | K22: '’ | L22: '’ | M22: '’
A24: Persistent storage
A25: Expects data from current session to be saved to persistence when created | B25: M1 | I25: 2 | J25: 3 | K25: of:=6*[.I25]/[.J25] -> 4 | L25: #11529 | M25: Activate persistent storage without the need to restart
A26: Restarts twice or more | B26: M1 | I26: '’ | J26: '’ | K26: '’ | L26: '’ | M26: '’
A27: Doesn’t think that Wi-Fi connection can be automated (after persistence) | B27: M1 | I27: 2 | J27: 3 | K27: of:=6*[.I27]/[.J27] -> 4 | L27: #15572 | M27: Redesign UI for the creation of persistent storage
A28: Thinks that an adversary who found the USB stick would know that Mumble is added | B28: M1 | I28: '’ | J28: '’ | K28: '’ | L28: '’ | M28: '’
A29: Doesn’t remember giving a passphrase when creating persistent storage | B29: M2 | I29: '’ | J29: '’ | K29: '’ | L29: '’ | M29: '’
A30: Link to doc from Persistence configuration is broken | B30: M1 | I30: 2 | J30: 1 | K30: of:=6*[.I30]/[.J30] -> 12 | L30: #8897 | M30: The link to persistence documentation in tails-persistence-setup doesn't trigger any user-visible action
A31: Thinks that Tor Browser in persistent storage is an application and not documents | B31: M2 | I31: 1 | J31: 3 | K31: of:=6*[.I31]/[.J31] -> 2 | L31: #15028 | M31: Rename "Tor Browser" shortcuts and folders
A32: Is not sure whether persistent storage is unlocked or not (when locked) | B32: M2
A33: Looks for a place to review everything that’s in the persistent storage | B33: M3
A34: Thinks that the admin password is enough to store custom config | B34: M1
A36: Notifications
A37: Clicks on a notification to get more info | B37: * | I37: 3 | M37: ?
A38: Doesn’t know where the notification tray is (P1: can’t find, P4: “never knows”) | B38: M1 | I38: 3 | M38: This is fixed already in new version of GNOME
A39: Thinks that Mumble is downloaded again | B39: M2 | I39: 1 | M39: ?
A41: Greeter
A42: Doesn’t notice persistence in Greeter at first | B42: M1 | I42: 2 | J42: 2 | K42: of:=6*[.I42]/[.J42] -> 6 | L42: #15573 | M42: Ask for confirmation when starting without unlocking the persistent storage
A43: Expects the “permanence” to be in Greeter (before creating a persistent storage) | B43: M1 | I43: 2 | J43: 2 | K43: of:=6*[.I43]/[.J43] -> 6 | L43: #15586 | M43: Instruct about the possibility of creating a persistent storage when there is none
A45: Documentation
A46: Doesn’t read well the documentation on admin password | B46: M1 | I46: 2 | J46: 1 | K46: of:=6*[.I46]/[.J46] -> 12 | L46: #15574 | M46: Improve scanability of instructions to configuration administration password
A48: Offline documentation
A49: Doesn’t find the user documentation in the offline doc | B49: M1 | I49: 2 | J49: 1 | K49: of:=6*[.I49]/[.J49] -> 12 | L49: #15575 | M49: Point to /doc instead of /getting_started from "Tails documentation" desktop launcher
A50: Would have liked the sidebar in the offline doc (when asked) | B50: M1 | I50: 2 | J50: 1 | K50: of:=6*[.I50]/[.J50] -> 12 | L50: #15576 | M50: Add back the sidebar on the offline documentation browser
A51: Tries to open tabs in offline doc | B51: M1 | I51: 1 | J51: 3 | K51: of:=6*[.I51]/[.J51] -> 2 | L51: #15577 | M51: Have tabs in the offline documentation browser
A52: Opens Help to look for Tails specific documentation (and doesn’t notice the offline doc) | B52: M1 | L52: ?
A54: Website
A55: Doesn’t use the sidebar to navigate | B55: M1 | I55: 2 | J55: 3 | K55: of:=6*[.I55]/[.J55] -> 4 | L55: #15112 | M55: Move our sidebar to the left (or to the top)
A56: Read the monthly report on top of /home instead of using the sidebar | B56: M1 | I56: '’ | J56: '’ | K56: '’ | L56: '’ | M56: '’
A57: Doesn’t see the sidebar in the Tails website | B57: M1 | I57: '’ | J57: '’ | K57: '’ | L57: '’ | M57: '’
A59: Additional Software configuration
A60: Expects AS to have a list of all possible software (after scanning the doc) | B60: M1 | M60: ?
A61: Doubts what the [X] button does | B61: M4 | I61: 2 | J61: 1 | K61: of:=6*[.I61]/[.J61] -> 12 | L61: #15578 | M61: Explain better what removing a package means
A62: Doubts whether Remove uninstalls or deletes | B62: M4 | I62: 1 | J62: 1 | K62: of:=6*[.I62]/[.J62] -> 6 | L62: '’ | M62: '’
A63: Looks online for how to get a list of all the installed packages (didn’t find AS) | B63: M3 | M63: ?
A64: Unlock in AS doesn’t say when | B64: M1 | I64: 2 | J64: 1 | K64: of:=6*[.I64]/[.J64] -> 12 | L64: #15580 | M64: Explain when "unlock your persistent storage" should happen
A65: Remove and Cancel don’t work after escaping password prompt | B65: M4 | I65: 1 | J65: 2 | K65: of:=6*[.I65]/[.J65] -> 3 | L65: #15581 | M65: Remove and Cancel buttons don't work after escaping password prompt
A67: Misc
A68: Doesn’t associate the Tor Browser error with being offline | B68: M1 | I68: 2 | J68: 3 | K68: of:=6*[.I68]/[.J68] -> 4 | L68: #9473 | M68: Improve "Unable to connect" error message from Tor Browser
A69: Tries `ping` to debug no network connectivity | B69: * | I69: '’ | J69: '’ | K69: '’ | L69: '’ | M69: '’
A70: Opens an app multiple times because of the lack of feedback | B70: * | I70: 1 | J70: 2 | K70: of:=6*[.I70]/[.J70] -> 3 | L70: #15546 | M70: Add feedback when opening Additional Software from Persistence setup
A71: Doesn’t see the restart button (P3 once, P4 three times) | B71: * | M71: ?
A73: System Usability Scale | C73: of:=2.5*(20+([.C74]+[.C76]+[.C78]+[.C80]+[.C82])-([.C75]+[.C77]+[.C79]+[.C81]+[.C83])) -> 65 | D73: of:=2.5*(20+([.D74]+[.D76]+[.D78]+[.D80]+[.D82])-([.D75]+[.D77]+[.D79]+[.D81]+[.D83])) -> 70 | E73: of:=2.5*(20+([.E74]+[.E76]+[.E78]+[.E80]+[.E82])-([.E75]+[.E77]+[.E79]+[.E81]+[.E83])) -> 72.5 | F73: of:=2.5*(20+([.F74]+[.F76]+[.F78]+[.F80]+[.F82])-([.F75]+[.F77]+[.F79]+[.F81]+[.F83])) -> 52.5 | G73: of:=2.5*(20+([.G74]+[.G76]+[.G78]+[.G80]+[.G82])-([.G75]+[.G77]+[.G79]+[.G81]+[.G83])) -> 80 | H73: of:=AVERAGE([.C73:.G73]) -> 68
A74: I think that I would like to use this system frequently. | C74: 5 | D74: 3 | E74: 4 | F74: 3 | G74: 3 | H74: of:=2.5*(AVERAGE([.C74:.G74])-1) -> 6.5
A75: I found the system unnecessarily complex. | C75: 4 | D75: 2 | E75: 2 | F75: 2 | G75: 1 | H75: of:=2.5*(5-AVERAGE([.C75:.G75])) -> 7
A76: I thought the system was easy to use. | C76: 4 | D76: 2 | E76: 4 | F76: 4 | G76: 5 | H76: of:=2.5*(AVERAGE([.C76:.G76])-1) -> 7
A77: I think that I would need the support of a technical person to be able to use this system. | C77: 2 | D77: 1 | E77: 2 | F77: 2 | G77: 4 | H77: of:=2.5*(5-AVERAGE([.C77:.G77])) -> 7
A78: I found the various functions in this system were well integrated. | C78: 4 | D78: 4 | E78: 5 | F78: 4 | G78: 5 | H78: of:=2.5*(AVERAGE([.C78:.G78])-1) -> 8.5
A79: I thought there was too much inconsistency in this system. | C79: 4 | D79: 1 | E79: 1 | F79: 3 | G79: 1 | H79: of:=2.5*(5-AVERAGE([.C79:.G79])) -> 7.5
A80: I would imagine that most people would learn to use this system very quickly. | C80: 4 | D80: 3 | E80: 2 | F80: 1 | G80: 3 | H80: of:=2.5*(AVERAGE([.C80:.G80])-1) -> 4
A81: I found the system very cumbersome to use. | C81: 2 | D81: 2 | E81: 2 | F81: 5 | G81: 1 | H81: of:=2.5*(5-AVERAGE([.C81:.G81])) -> 6.5
A82: I felt very confident using the system. | C82: 4 | D82: 4 | E82: 5 | F82: 4 | G82: 5 | H82: of:=2.5*(AVERAGE([.C82:.G82])-1) -> 8.5
A83: I needed to learn a lot of things before I could get going with this system. | C83: 3 | D83: 2 | E83: 4 | F83: 3 | G83: 2 | H83: of:=2.5*(5-AVERAGE([.C83:.G83])) -> 5.5

Sheet: demographics
B1: P1 | C1: P2 | D1: P3 | E1: P4 | F1: P5
A2: Gender | B2: Woman | C2: Man | D2: Man | E2: Woman | F2: Man
A3: Age | B3: 35-40 | C3: 35-40 | D3: 40-45 | E3: 40-45 | F3: 35-40
A4: Occupation | B4: Communication | C4: IT call center | D4: IT teacher | E4: Nurse | F4: Rural worker
A5: English | B5: Little | C5: Good | D5: Good | E5: Native | F5: Good
A6: Experience with Tails | B6: Tried it | C6: Tried it | D6: Tried it | E6: Tried it | F6: Tried it
A7: Regular operating system | B7: Jessie GNOME | C7: Ubuntu LXDE | D7: Stretch GNOME | E7: Stretch GNOME | F7: Jessie GNOME