Sheet: issues
B1: M?
A2: Participant | C2: P1 | D2: P2 | E2: P3 | F2: P4 | G2: P5 | I2: V | J2: C | K2: V/C | L2: Ticket | M2: Solution
A3: Mission completeness
A4: Mission 1: | C4: 1 | D4: 1 | E4: 0 | F4: 1 | G4: 1
A5: Time on mission 1 | C5: 13 | D5: 17 | E5: 11 | F5: 8 | G5: 16 | H5: of:=AVERAGE([.C5:.G5]) -> 13
A6: Mission 2: | C6: 1 | D6: 1 | E6: 1 | F6: 1 | G6: 1
A7: Time on mission 2 | C7: 12 | D7: 1 | E7: 1 | F7: 1 | G7: 2 | H7: of:=AVERAGE([.C7:.G7]) -> 3.4
A8: Mission 3: | C8: 1 | D8: 1 | E8: 0 | F8: 0 | G8: 1
A9: Time on mission 3 | C9: 9 | D9: 18 | E9: 26 | F9: 25 | G9: 11 | H9: of:=AVERAGE([.C9:.G9]) -> 17.8
A10: Total time on missions | C10: of:=[.C5]+[.C7]+[.C9] -> 34 | D10: of:=[.D5]+[.D7]+[.D9] -> 36 | E10: of:=[.E5]+[.E7]+[.E9] -> 38 | F10: of:=[.F5]+[.F7]+[.F9] -> 34 | G10: of:=[.G5]+[.G7]+[.G9] -> 29
A12: VeraCrypt integration
A13: Needs the doc to complete mission 1 | B13: M1 | I13: 3 | K13: of:=[.I13]/[.J13] ->  | L13: #15043 | M13: VeraCrypt Mounter
A14: Looks for VeraCrypt in “Open With Other Application | B14: M1 | I14: 3 | K14: of:=[.I14]/[.J14] ->  | L14: #15043 | M14: VeraCrypt Mounter
A15: Looks for VeraCrypt in “Applications” menu | B15: M1 | I15: 3 | K15: of:=[.I15]/[.J15] ->  | L15: #15043 | M15: VeraCrypt Mounter
A16: Doesn’t read or understand the error message on a wrong password | B16: M* | I16: 2 | K16: of:=[.I16]/[.J16] ->  | L16: #15663 | M16: Improve error messages when unlocking a VeraCrypt volume fails
A17: Is confused by the lack of feedback when opening a volume | B17: M* | I17: 2 | K17: of:=[.I17]/[.J17] ->  | L17: #15664 | M17: Provide feedback while unlocking a VeraCrypt volume
A18: Types the password in Gvfs and then opens Disks | B18: M3 | I18: 1 | K18: of:=[.I18]/[.J18] ->  | L18: #15671 | M18: Rethink how Disks is pointed to from GVfs monitor
A19: Tries to use Disks to locate the keyfile | B19: M3 | K19: '’ | L19: '’ | M19: '’
A20: Opening keyfiles in ~/Tor Browser from Disks doesn’t work | I20: 2 | K20: of:=[.I20]/[.J20] ->  | L20: #15665 | M20: Impossible to use keyfile in ~/Tor Browser
A21: Impossible to detach a disk image from Disks | I21: 1 | K21: of:=[.I21]/[.J21] ->  | L21: #15666 | M21: Administration password required to detach a disk image from Disks
A22: No VeraCrypt integration when opening volume from file chooser | B22: M3 | I22: 1 | K22: of:=[.I22]/[.J22] ->  | L22: #15667 | M22: No VeraCrypt integration in file chooser
A24: Upstream UX
A25: Doesn’t find the “Disks” menu in the top navigation bar | B25: M* | I25: 2 | J25: 1 | K25: of:=[.I25]/[.J25] -> 2 | L25: #15668 | M25: Add screenshot to locate Disks menu in top navigation bar
A26: Needs the doc to find the “unlock” button of Disks | B26: M3 | I26: 1 | J26: 1 | K26: of:=[.I26]/[.J26] -> 1 | L26: #15676 | M26: Circle the "Unlock" button of Disks in red in the VeraCrypt doc
A27: Doesn’t see “TOSHIBA” in the sidebar | B27: M1 | K27: of:=[.I27]/[.J27] -> 
A28: Is confused by the “unlock” icon having a “unlock pad” icon | B28: M3 | K28: of:=[.I28]/[.J28] -> 
A30: Other parts of Tails
A31: Wants an option to search the offline documentation | B31: M1 | I31: 1 | K31: of:=[.I31]/[.J31] ->  | L31: #6569 | M31: Make the Tails documentation searchable offline
A32: Gets lost in the navigation of the documentation browser | B32: M3 | I32: 2 | K32: of:=[.I32]/[.J32] ->  | L32: #15576 | M32: Add back the sidebar on the offline documentation browser
A33: Is confused by the lack of automount | B33: M1 | I33: 2 | K33: of:=[.I33]/[.J33] ->  | L33: #15628 | M33: Consider re-enabling automounting
A34: Doesn’t notice the new label in the sidebar | B34: M1 | K34: '’ | L34: '’ | M34: '’
A35: Doesn’t understand what to do with the “Filesystem” in Disks | B35: M3 | K35: '’ | L35: '’ | M35: '’
A36: Has a hard time knowing where to save a file from Tor Browser | B36: M3 | I36: 2 | K36: of:=[.I36]/[.J36] ->  | L36: #15678 | M36: Improve UX of saving files in Tor Browser
A37: Thinks that the file was saved in Tor Browser when it was not | B37: M3 | K37: of:=[.I37]/[.J37] ->  | L37: '’ | M37: '’
A39: Documentation
A40: Confuses “Files” and “Disks” in the doc with the type of encryption | B40: M* | I40: 3 | J40: 2 | K40: of:=[.I40]/[.J40] -> 1.5 | L40: #15670 | M40: Improve the navigation of the VeraCrypt documentation
A41: Follows the wrong doc section | B41: M* | K41: of:=[.I41]/[.J41] ->  | L41: '’ | M41: '’
A42: Looks for “Disk Image Mounter” in the right-click menu | B42: M1 | I42: 1 | J42: 1 | K42: of:=[.I42]/[.J42] -> 1 | L42: #15677 | M42: Add a screenshot for "Disk Image Mounter" in VeraCrypt documentation
A43: Opens “Files” a second time while reading the doc | B43: M* | I43: 2 | K43: of:=[.I43]/[.J43] ->  | L43: #15669 | M43: Avoid naming GNOME core apps by their common noun name
A44: Doesn’t understand that “Files” and “Disks” relate to applications | B44: M* | K44: of:=[.I44]/[.J44] ->  | L44: '’ | M44: '’
A46: System Usability Scale | C46: of:=2.5*(20+([.C47]+[.C49]+[.C51]+[.C53]+[.C55])-([.C48]+[.C50]+[.C52]+[.C54]+[.C56])) -> 65 | D46: of:=2.5*(20+([.D47]+[.D49]+[.D51]+[.D53]+[.D55])-([.D48]+[.D50]+[.D52]+[.D54]+[.D56])) -> 37.5 | E46: of:=2.5*(20+([.E47]+[.E49]+[.E51]+[.E53]+[.E55])-([.E48]+[.E50]+[.E52]+[.E54]+[.E56])) -> 60 | F46: of:=2.5*(20+([.F47]+[.F49]+[.F51]+[.F53]+[.F55])-([.F48]+[.F50]+[.F52]+[.F54]+[.F56])) -> 47.5 | G46: of:=2.5*(20+([.G47]+[.G49]+[.G51]+[.G53]+[.G55])-([.G48]+[.G50]+[.G52]+[.G54]+[.G56])) -> 80 | H46: of:=AVERAGE([.C46:.G46]) -> 58
A47: I think that I would like to use this system frequently. | C47: 3 | D47: 3 | E47: 4 | F47: 4 | G47: 3 | H47: of:=2.5*(AVERAGE([.C47:.G47])-1) -> 6
A48: I found the system unnecessarily complex. | C48: 2 | D48: 2 | E48: 2 | F48: 4 | G48: 1 | H48: of:=2.5*(5-AVERAGE([.C48:.G48])) -> 7
A49: I thought the system was easy to use. | C49: 3 | D49: 4 | E49: 3 | F49: 2 | G49: 4 | H49: of:=2.5*(AVERAGE([.C49:.G49])-1) -> 5.5
A50: I think that I would need the support of a technical person to be able to use this system. | C50: 2 | D50: 5 | E50: 3 | F50: 3 | G50: 1 | H50: of:=2.5*(5-AVERAGE([.C50:.G50])) -> 5.5
A51: I found the various functions in this system were well integrated. | C51: 4 | D51: 2 | E51: 4 | F51: 3 | G51: 4 | H51: of:=2.5*(AVERAGE([.C51:.G51])-1) -> 6
A52: I thought there was too much inconsistency in this system. | C52: 2 | D52: 3 | E52: 2 | F52: 2 | G52: 2 | H52: of:=2.5*(5-AVERAGE([.C52:.G52])) -> 7
A53: I would imagine that most people would learn to use this system very quickly. | C53: 2 | D53: 1 | E53: 4 | F53: 1 | G53: 3 | H53: of:=2.5*(AVERAGE([.C53:.G53])-1) -> 3
A54: I found the system very cumbersome to use. | C54: 1 | D54: 3 | E54: 2 | F54: 4 | G54: 2 | H54: of:=2.5*(5-AVERAGE([.C54:.G54])) -> 6.5
A55: I felt very confident using the system. | C55: 4 | D55: 3 | E55: 2 | F55: 4 | G55: 5 | H55: of:=2.5*(AVERAGE([.C55:.G55])-1) -> 6.5
A56: I needed to learn a lot of things before I could get going with this system. | C56: 3 | D56: 5 | E56: 4 | F56: 2 | G56: 1 | H56: of:=2.5*(5-AVERAGE([.C56:.G56])) -> 5

Sheet: demographics
B1: P1 | C1: P2 | D1: P3 | E1: P4 | F1: P5
A2: Gender | B2: Man | C2: Man | D2: Woman | E2: Woman | F2: Man
A3: Age | B3: 35-40 | C3: 35-40 | D3: 35-40 | E3: 35-40 | F3: 30-35
A4: Occupation | B4: IT call center | C4: IT call center | D4: Student | E4: Nurse | F4: Student
A5: English | B5: Good | C5: Good | D5: Good | E5: Native | F5: Basic
A6: Experience with Tails | B6: Tried it | C6: Tried it | D6: Doesn’t know | E6: Tried it | F6: Heard about it
A7: Experience with VeraCrypt | B7: Tried it | C7: Heard about it | D7: Doesn’t know | E7: Heard about it | F7: Doesn’t know
A8: Regular operating system | B8: Lubuntu | C8: Win 7 + Lubuntu | D8: Ubuntu | E8: Debian GNOME | F8: macOS

Sheet: P1
A1: Mission 1 | B1: PT15H19M00S | C1: Opens the USB stick and locate the file container
B2: PT15H20M00S | C2: Opens Tails documentation
B3: PT15H23M00S | C3: Confuses “Files” and “Disks” with the type of encryption
B4: PT15H29M00S | C4: “Opens with Other Application”
A5: of:=[.B5]-[.B1] -> PT00H13M00S | B5: PT15H32M00S | C5: Unlocks the file container
A7: Mission 2 | B7: PT15H34M00S | C7: Unlocks the partition
B8: PT15H36M00S | C8: Understand keyfiles
B9: PT15H37M00S | C9: Error message because of wrong password
B10: PT15H38M00S | C10: Follows the doc to unlock a file container using Disks
B11: PT15H37M00S | C11: Opens “Disks”
B12: PT15H38M00S | C12: Doesn’t find the top navigation bar menu
C13: Can’t select a file container to mount
B14: PT15H41M00S | C14: Wonders if he’s following the right doc
B15: PT15H42M00S | C15: Opens the partition and realized he mistyped the password
B16: PT15H44M00S | C16: Has netherlands.pdf attached as a disk image
B17: PT15H45M00S | C17: Still tries to follow the file container documentation
A18: of:=[.B18]-[.B7] -> PT00H12M00S | B18: PT15H46M00S | C18: Realizes he finished the mission and got lost
B19: PT15H47M00S | C19: Can’t detach the disk image without administration password
A21: Mission 3 | B21: PT15H48M00S | C21: Opens Tor Browser
B22: PT15H48M00S | C22: Clicks on the sidebar of Files and open Disks to use keyfiles
B23: PT15H49M00S | C23: Goes back to the doc
B24: PT15H49M00S | C24: Opens the VeraCrypt documentation on keyfiles and gets scared
B25: PT15H50M00S | C25: Follows the doc
B26: PT15H53M00S | C26: Checks the “lock” icon in Disks but not on the “unlock” button
B27: PT15H53M00S | C27: Clicks the “unlock” button after reading the doc
B28: PT15H54M00S | C28: Uses “Show passphrase”
B29: PT15H54M00S | C29: Type the URL of the keyfile in Tor Browser
B30: PT15H56M00S | C30: Opens the partition
B31: PT15H57M00S | C31: Doesn’t understand the layering of the filesystem in Disks
A32: of:=[.B32]-[.B21] -> PT00H09M00S | B32: PT15H57M00S | C32: Opens the folder in Files

Sheet: P2
A1: Mission 1 | B1: PT17H07M00S | C1: Doesn’t find the USB stick in the sidebar of “Files”
C2: Looks in “Other Locations”
B3: PT17H12M00S | C3: Chooses “Open with Other Application”
B4: PT17H12M00S | C4: Wonders about “Encrypt...” in the right-click menu
C5: “Open with Videos”
C6: “Open with Other Application”
B7: PT17H13M00S | C7: Searches for “VeraCrypt” in “Other Application”
B8: PT17H13M00S | C8: Tries “Encrypt...” and think it’s to send it by email
B9: PT17H14M00S | C9: Looks for “VeraCrypt” in the “Applications” menu
B10: PT17H15M00S | C10: Tries “Clean metadata”
B11: PT17H15M00S | C11: Tries “Properties”
B12: PT17H17M00S | C12: Opens the documentation
B13: PT17H17M00S | C13: Wants an option to search the doc
B14: PT17H18M00S | C14: Wonders about how the encryption works
B15: PT17H21M00S | C15: Ejects the USB stick by mistake
B16: PT17H22M00S | C16: Uses “Disk Image Mounter”
A17: of:=[.B17]-[.B1] -> PT00H17M00S | B17: PT17H24M00S | C17: Unlocks the file container
B18: PT17H25M00S | C18: Tries right-click on sidebar label instead of eject button
A20: Mission 2 | B20: PT17H26M00S | C20: Plugs the USB stick
A21: of:=[.B21]-[.B20] -> PT00H01M00S | B21: PT17H27M00S | C21: Unlocks the partition
A23: Mission 3 | B23: PT17H30M00S | C23: Plugs the USB stick
B24: PT17H31M00S | C24: Clicks “Home” on the offline doc to go back to the beginning
B25: PT17H39M00S | C25: Has trouble saving the keyfile
B26: PT17H41M00S | C26: Types the password in Gvfs monitor and then opens “Disks”
B27: PT17H43M00S | C27: Closes “Disks” because he thinks it’s not the way to go
B28: PT17H43M00S | C28: Doesn’t know where the keyfile is saved
B29: PT17H44M00S | C29: Follows the doc about unlocking a file container
B30: PT17H45M00S | C30: Doesn’t find the “Disks” menu in the top navigation bar
B31: PT17H46M00S | C31: Finds the “unlock” button in “Disks”
A32: of:=[.B32]-[.B23] -> PT00H18M00S | B32: PT17H48M00S | C32: Clicks on the label in the sidebar of “Files”

Sheet: P3
A1: Mission 1 | B1: PT09H32M00S | C1: Plugs in the USB stick
B2: PT09H33M00S | C2: Wonders when the USB stick doesn’t show up in the “Places” menu
B3: PT09H33M00S | C3: Clicks on “Persistent” in the “Places” menu
B4: PT09H35M00S | C4: Double clicks on the MP3 file and expects being asked for a password
B5: PT09H36M00S | C5: Looks for “VeraCrypt” in the “Applications” menu
B6: PT09H39M00S | C6: Asks for help!
B7: PT09H40M00S | C7: Opens VeraCrypt documentation
B8: PT09H41M00S | C8: Understands that it’s a file and not a partition
A9: of:=[.B9]-[.B1] -> PT00H11M00S | B9: PT09H43M00S | C9: Double clicks on the label in the sidebar of “Files” and gets “Windows System Volume” selected by mistake
B10: PT09H44M00S | C10: Doesn’t realize that the “eject” button of “Files” is to eject
A12: Mission 2 | B12: PT09H47M00S | C12: Clicks on the label in the sidebar of “Files”
A13: of:=[.B13]-[.B12] -> PT00H01M00S | B13: PT09H48M00S
A15: Mission 3 | B15: PT09H50M00S | C15: Plugs in the USB stick
B16: PT09H50M00S | C16: Clicks on the label in the sidebar of “Files”
B17: PT09H50M00S | C17: Enters the password in Gvfs monitor
B18: PT09H51M00S | C18: Gets an error message because of no keyfile
B19: PT09H51M00S | C19: Doesn’t know what the error message was about
C20: Needs help to understand the keyfile
B21: PT09H54M00S | C21: Open Tor Browser to download the keyfile
B22: PT09H56M00S | C22: Has trouble saving the keyfile using Tor Browser
B23: PT09H56M00S | C23: Saves to “Desktop” despite error message in Tor Browser
B24: PT09H59M00S | C24: Tries to open the keyfile with “Disk Image Mounter”
B25: PT10H07M00S | C25: Is lost in the documentation
B26: PT10H09M00S | C26: Follows the doc to unlock a file container
B27: PT10H10M00S | C27: I redirect her to the doc on unlocking a partition with Disks
B28: PT10H11M00S | C28: Tries to unlock without specifying the keyfile
B29: PT10H14M00S | C29: Enters the keyfile
B30: PT10H14M00S | C30: Wonders what to do next
B31: PT10H15M00S | C31: Tries to click the “play” icon of Disks to open the folder
A32: of:=[.B32]-[.B15] -> PT00H26M00S | B32: PT10H16M00S | C32: Clicks on the “/media” link
A34: of:=[.B34]-[.B15] -> -PT09H50M00S

Sheet: P4
A1: Mission 1 | B1: PT15H19M00S | C1: Plugs in the USB
B2: PT15H20M00S | C2: Searches for “VeraCrypt” in Activities overview
C3: Opens the USB stick
C4: “Open With Another Application”
C5: Searches for “VeraCrypt”
C6: Executes “VeraCrypt” on the command line
C7: Checks “OpenPGP Applet”
B8: PT15H22M00S | C8: Feels stuck
C9: Opens “Tor Browser” and search for “VeraCrypt”
B10: PT15H23M00S | C10: Complains about no indication when opening
C11: Remembers about the documentation
B12: PT15H24M00S | C12: Wants to search inside the documentation with Ctrl+F
C13: “VeraCrypt is disk encryption and not file encryption”
B14: PT15H26M00S | C14: “Open With Another Application” → “Disk Image Mounter”
A15: of:=[.B15]-[.B1] -> PT00H08M00S | B15: PT15H27M00S | C15: Finishes the mission
A17: Mission 3 | B17: PT15H27M00S | C17: Plugs in the USB stick
B18: PT15H28M00S | C18: Opens the encrypted volume
B19: PT15H29M00S | C19: Opens the keyfile in “Tor Browser” and wonders about the cat picture
B20: PT15H30M00S | C20: Tries entering the password from “Files” and wonders what’s going on
B21: PT15H31M00S | C21: Goes back to “Disks”
B22: PT15H32M00S | C22: Tries to understand what the different devices are
B23: PT15H32M00S | C23: Hyperlink doesn’t work in documentation browser
B24: PT15H32M00S | C24: Tries to follow doc on unlocking a file container with “Disks”
B25: PT15H34M00S | C25: Thinks she’s not in the right program because she can’t find “Attach Disk Image”
B26: PT15H37M00S | C26: Feels stuck: “I can’t follow the instructions.”
B27: PT15H39M00S | C27: I point her to the right doc but doesn’t understand why she would do that
B28: PT15H42M00S | C28: “I wouldn’t think it’s a partition because it’s the whole disk.”
B29: PT15H43M00S | C29: Explains that she thought the “unlock” icon meant it was unlocked already
B30: PT15H43M00S | C30: Tries to save the keyfile
B31: PT15H46M00S | C31: “Why am I using a computer I don’t have the permission to use.”
B32: PT15H47M00S | C32: “It is fucking kafkaesque.”
B33: PT15H50M00S | C33: I try to help her but fail
B34: PT15H51M00S | C34: Keyfile finally save to home
A35: of:=[.B35]-[.B17] -> PT00H25M00S | B35: PT15H52M00S | C35: Open the encrypted volume
A48: of:=[.B48]-[.B37] -> PT00H00M00S

Sheet: P5
A1: Mission 1 | B1: PT20H09M00S | C1: Open the USB stick in “Files”
B2: PT20H10M00S | C2: Searches for “VeraCrypt” in “Open With Other Application”
B3: PT20H11M00S | C3: Open “Tails documentation”
C4: Wants a way to search the offline documentation
C5: Searches for “VeraCrypt” in /doc/features
B6: PT20H19M00S | C6: Looks at “Encrypt...” in the right-click menu
C7: Open “Properties”
C8: Thinks “file container” doesn’t correpond because he wants to open a “file” not a “file container”
B9: PT20H20M00S | C9: Looks for “Disk Image Mounter” in the right-click menu
C10: Open “Files” a second time, to be sure
C11: Tries “Disk Image Mounter” on folder instead of file
B12: PT20H24M00S | C12: “Disk Image Mounter” on file container
C13: “Now it should work? Why nothing happens?”
C14: Doesn’t notice the encrypted volume in the sidebar and opens the container a second time
A15: of:=[.B15]-[.B1] -> PT00H16M00S | B15: PT20H25M00S | C15: Opens the volume
B16: PT20H26M00S | C16: Can’t eject the USB stick because of second mounted image (which is locked)
A18: Mission 2 | B18: PT20H28M00S | C18: Plugs in the USB stick
C19: Doesn’t like that the USB stick appears straight away
C20: Enters wrong password
B21: PT20H29M00S | C21: Is confused by lack of feedback
B22: PT20H30M00S | C22: Closes error message without noticing
C23: Wants to go back to the documentation
A24: of:=[.B24]-[.B18] -> PT00H02M00S | B24: PT20H30M00S | C24: Tries again (after a bit of priming by me)
B25: PT20H31M00S | C25: Can’t detach file container from “Disks”
A27: Mission 3 | B27: PT20H31M00S | C27: Open “Tor Browser”
B28: PT20H32M00S | C28: Is confused by lack of feedback when opening “Tor Browser”
B29: PT20H33M00S | C29: Tries saving the keyfile to the encrypted partition
B30: PT20H34M00S | C30: Tries “Disk Image Mounter” on keyfile
B31: PT20H34M00S | C31: Types password only in Gvfs monitor
B32: PT20H35M00S | C32: Reads error message
C33: Clicks on “Open Disks”
C34: Looks for the file in “Disks”
C35: Closes “Disks” another time (twice)
B36: PT20H37M00S | C36: Goes back to the documentation
B37: PT20H38M00S | C37: Feels lost in the doc
C38: “For me an application is not a disk…”
B39: PT20H39M00S | C39: Follows doc to unlock file containers using “Disks”
C40: Doesn’t find the “Attach Disk Image”
B41: PT20H42M00S | C41: Finds the “unlock” button while navigating freely