Sheet: issues
B1: M?
A2: Participant | C2: P1 | D2: P2 | E2: P3 | F2: P4 | G2: P5 | I2: B | J2: C | K2: B/C | L2: Ticket | M2: Solution
A3: Mission completeness
A4: Mission 1:
A5: Time on mission 1 | H5: of:=AVERAGE([.C5:.F5]) -> 
A6: Mission 2:
A7: Mission 3:
A8: Mission 4:
A10: Section 1
A11: Something happens | B11: M1 | I11: 2 | J11: 3 | K11: of:=6*[.I11]/[.J11] -> 4 | L11: #12345 | M11: Fix that thing
A13: System Usability Scale | C13: of:=2.5*(20+([.C14]+[.C16]+[.C18]+[.C20]+[.C22])-([.C15]+[.C17]+[.C19]+[.C21]+[.C23])) -> 50 | D13: of:=2.5*(20+([.D14]+[.D16]+[.D18]+[.D20]+[.D22])-([.D15]+[.D17]+[.D19]+[.D21]+[.D23])) -> 50 | E13: of:=2.5*(20+([.E14]+[.E16]+[.E18]+[.E20]+[.E22])-([.E15]+[.E17]+[.E19]+[.E21]+[.E23])) -> 50 | F13: of:=2.5*(20+([.F14]+[.F16]+[.F18]+[.F20]+[.F22])-([.F15]+[.F17]+[.F19]+[.F21]+[.F23])) -> 50 | G13: of:=2.5*(20+([.G14]+[.G16]+[.G18]+[.G20]+[.G22])-([.G15]+[.G17]+[.G19]+[.G21]+[.G23])) -> 50 | H13: of:=AVERAGE([.C13:.G13]) -> 50
A14: I think that I would like to use this system frequently. | H14: of:=2.5*(AVERAGE([.C14:.G14])-1) -> 
A15: I found the system unnecessarily complex. | H15: of:=2.5*(5-AVERAGE([.C15:.G15])) -> 
A16: I thought the system was easy to use. | H16: of:=2.5*(AVERAGE([.C16:.G16])-1) -> 
A17: I think that I would need the support of a technical person to be able to use this system. | H17: of:=2.5*(5-AVERAGE([.C17:.G17])) -> 
A18: I found the various functions in this system were well integrated. | H18: of:=2.5*(AVERAGE([.C18:.G18])-1) -> 
A19: I thought there was too much inconsistency in this system. | H19: of:=2.5*(5-AVERAGE([.C19:.G19])) -> 
A20: I would imagine that most people would learn to use this system very quickly. | H20: of:=2.5*(AVERAGE([.C20:.G20])-1) -> 
A21: I found the system very cumbersome to use. | H21: of:=2.5*(5-AVERAGE([.C21:.G21])) -> 
A22: I felt very confident using the system. | H22: of:=2.5*(AVERAGE([.C22:.G22])-1) -> 
A23: I needed to learn a lot of things before I could get going with this system. | H23: of:=2.5*(5-AVERAGE([.C23:.G23])) -> 

Sheet: demographics
B1: P1 | C1: P2 | D1: P3 | E1: P4 | F1: P5
A2: Gender
A3: Age
A4: Occupation
A5: English
A6: Experience with Tails
A7: Regular operating system